Unnamed: 0,name,description,picture_url,host_since,host_response_time,host_is_superhost,host_listings_count,host_identity_verified,room_type,accommodates,bathrooms_text,bedrooms,beds,amenities,price,availability_90,number_of_reviews,review_scores_rating,review_scores_accuracy,review_scores_cleanliness,review_scores_checkin,review_scores_communication,review_scores_location,review_scores_value,instant_bookable
0,Be & Being (Milena) - next to Sabbioni Beach,"Be & Being is a modern apartment located in a very quiet area of Riva del Garda a few steps from the Garda Lake's beach. The apartment consists of a large and bright living room, a spacious and well-equipped kitchen, two bedrooms and one bathroom with bathtub; the living room is surrounded by by an outdoor private panoramic panoramic terrace where you can relax, eat together, or sunbathe. A private car box is also included. The space Be & Being is located in Viale Umberto Cattoni, on the street that running parallel with Viale Rovereto where there are delicious restaurants, excellent ice cream parlors and entertaining clubs. A two minute walking from the apartment there is one of the largest and sunniest beaches of the lake (""Spiaggia Sabbioni"") through which passes the bike path and pedestrian path that runs along the north coast of Lake Garda. A short distance from the apartment there are also the POLI supermarket, the pharmacy, the bank, and the newsagen",https://a0.muscache.com/pictures/miso/Hosting-42433599/original/47df88d7-dd0d-49b5-b93b-2e031e993ec7.jpeg,2020-02-20,within an hour,t,1.0,t,Entire home/apt,4,1 bath,2.0,2.0,"[""Long term stays allowed"", ""Wifi"", ""Body soap"", ""Outdoor dining area"", ""Stainless steel gas stove"", ""Hair dryer"", ""Carbon monoxide alarm"", ""Baking sheet"", ""Babysitter recommendations"", ""Free street parking"", ""Freezer"", ""Toaster"", ""Smoke alarm"", ""Shampoo"", ""Outdoor furniture"", ""Cleaning products"", ""Private patio or balcony"", ""Free washer \u2013 In unit"", ""Pocket wifi"", ""Free driveway parking on premises \u2013 1 space"", ""Mosquito net"", ""Bed linens"", ""Stainless steel oven"", ""Elevator"", ""Hot water kettle"", ""Coffee maker"", ""TV"", ""Cooking basics"", ""Luggage dropoff allowed"", ""Dining table"", ""Bathtub"", ""Room-darkening shades"", ""Bidet"", ""Drying rack for clothing"", ""Pack \u2019n play/Travel crib - available upon request"", ""Refrigerator"", ""Hot water"", ""Portable fans"", ""Wine glasses"", ""Essentials"", ""Dishes and silverware"", ""Clothing storage: wardrobe, closet, and dresser"", ""Kitchen"", ""Building staff"", ""Central heating"", ""Extra pillows and blankets"", ""Dedicated workspace"", ""Microwave"", ""Hangers""]",$86.00,77,31,4.9,4.9,4.9,4.97,5.0,4.97,4.77,f
1,Casa Carina 022251-AT-330714, Guest access A disposizione ce un ampio balcone un grande soggiorno dove poter fare colazione...,https://a0.muscache.com/pictures/36f6b80b-0b1a-4b59-802f-28ffce85abbb.jpg,2019-04-24,within an hour,f,3.0,t,Private room,3,1 shared bath,1.0,2.0,"[""Long term stays allowed"", ""Heating"", ""Wifi"", ""Hair dryer"", ""Free street parking"", ""Iron"", ""Toaster"", ""Clothing storage: closet"", ""Private entrance"", ""Free parking on premises"", ""Fire extinguisher"", ""Lock on bedroom door"", ""Bed linens"", ""Host greets you"", ""Hot water kettle"", ""Coffee maker"", ""Shared patio or balcony"", ""TV"", ""Backyard"", ""Luggage dropoff allowed"", ""Dining table"", ""First aid kit"", ""Room-darkening shades"", ""Bidet"", ""Hot water"", ""Essentials"", ""Dishes and silverware"", ""Extra pillows and blankets"", ""Breakfast"", ""Hangers""]",$55.00,0,81,4.63,4.84,4.91,4.89,4.84,4.52,4.65,t
2,"026 Bilocale con caminetto, Giustino","In the immediate vicinity of Pinzolo, in the raised area of ​​Giustino, a pleasant two-room apartment on the fourth floor with lift. Composed of living room with double sofa bed, fireplace and balcony. Separate kitchen (not habitable). Hallway to the sleeping area, bathroom without window with tub and shower microphone, a double bedroom. Particularly quiet area. It has a private parking space in the garage( small place, fits only small car) and a cellar / ski room. Pets Allowed.. The space undefined In the immediate vicinity of Pinzolo, in the raised area of ​​Giustino, a pleasant two-room apartment on the fourth floor with lift. Composed of living room with double sofa bed, fireplace and balcony. Separate kitchen (not habitable). Hallway to the sleeping area, bathroom without window with tub and shower microphone, a double bedroom. Particularly quiet area. It has a private parking space in the garage( small place, fits only small car) and a cellar / ski room.",https://a0.muscache.com/pictures/prohost-api/Hosting-53536257/original/7772e8f1-f66c-4d49-b5ab-e008b0b3f194.jpeg,2016-10-04,within a few hours,f,54.0,t,Entire home/apt,4,1 bath,1.0,2.0,"[""Washer"", ""Elevator"", ""Long term stays allowed"", ""Free parking on premises"", ""Heating"", ""Coffee maker"", ""Dishes and silverware"", ""TV"", ""Hair dryer"", ""Crib"", ""Kitchen"", ""Cooking basics"", ""Oven"", ""Patio or balcony"", ""Bathtub"", ""Stove"", ""Iron"", ""Freezer"", ""Indoor fireplace"", ""Refrigerator""]",$72.00,79,1,5.0,5.0,5.0,5.0,5.0,3.0,3.0,t
3,Appartamento nel cuore della Val di Fiemme,"Appartamento molto caldo e confortevole a 2 passi dal centro di Ziano di Fiemme;fornito di tutti gli accessori elettrodomestici, vicinissimo alla fermata Skibus gratuito per raggiungere tutti gli impianti della Val di Fiemme: Pampeago- Obereggen Predazzo - -Bellamonte- Lusia e Cermis; a 30 km da Campitello per tutte le stazioni del Sella Ronda.Infine a 10 km il paradiso dello sci da Fondo a Passo Lavaze' SCONTO 30% SCI E SCARPONI A NOLEGGIO; LE INDICAZIONI ALLA CONFERMA DELLA PRENOTAZIONE, The space Quattro sono gli spazi: camera da letto matrimoniale; camera da letto a castello; soggiorno e angolo cottura ; balcone esterno con tavoli e sedie Guest access Tutti perché l’appartamento è tutto per loro Other things to note Subito a ridosso del centro con alle spalle il fiume per splendide passeggiate hanno uno skybus gratuito per trasporto sulle piste da sci e impianti al Top; uno sconto Noleggio sci scarponi e tavo",https://a0.muscache.com/pictures/2cb0b950-62e3-4aa2-aa1c-7f355b280657.jpg,2017-04-01,within an hour,f,2.0,t,Entire home/apt,5,1 bath,2.0,3.0,"[""Washer"", ""Essentials"", ""Long term stays allowed"", ""Private entrance"", ""Free parking on premises"", ""Heating"", ""Wifi"", ""Shampoo"", ""Breakfast"", ""Host greets you"", ""Hair dryer"", ""TV"", ""Kitchen"", ""Luggage dropoff allowed"", ""Iron"", ""Hangers""]",$65.00,63,17,4.41,4.59,4.47,4.76,4.71,4.59,4.59,t
4,Tonale -Vista mozzafiato a 300m da impianti.,"Luminoso e grazioso bilocale d'angolo di 30m2 all'undicesimo ed ultimo piano con vista eccezionale sulle montagne e sulla vallata. Recentemente aggiornato, è composto da ingresso, soggiorno con angolo cottura, camera da letto matrimoniale e bagno con finestra. Cucina con piano ad induzione, frigo e lavello. Soggiorno con divano letto (2 letti singoli), tavolo, 5 sedie e TV. Finestre panoramiche con tende oscuranti. Camera separata dal soggiorno da porta scorrevole. Riscaldamento autonomo. The space L'appartamento è grazioso e dotato di tutti i confort. Oltre a TV e frigo, ha in dotazione un forno elettrico ed una griglia elettrica. Per i bambini c'è anche uno slittino da poter utilizzare sulla vicina pista. Guest access Tutti gli spazi dell'appartamento sono a disposizione degli ospiti Other things to note È possibile sistemare anche gruppi con più di 4 ospiti utilizzando un secondo apt sullo stesso piano o al",https://a0.muscache.com/pictures/17885e5e-17fd-4cb4-a749-2829a6a39ace.jpg,2018-11-27,within an hour,f,1.0,f,Entire home/apt,3,1 bath,1.0,3.0,"[""Long term stays allowed"", ""Heating"", ""Hair dryer"", ""Oven"", ""Free street parking"", ""Free parking on premises"", ""Shampoo"", ""Bed linens"", ""Elevator"", ""TV"", ""Cooking basics"", ""Room-darkening shades"", ""Refrigerator"", ""Hot water"", ""2 fuochi stainless steel induction stove"", ""Essentials"", ""Dishes and silverware"", ""Kitchen"", ""Building staff"", ""Extra pillows and blankets"", ""Hangers""]",$39.00,90,54,4.44,4.43,4.57,4.78,4.78,4.67,4.43,t
5,Garda View Guest House (CIPAT 022191-AT-068748),"Garda View Guest House, la meravigliosa vista lago - A Gavazzo Vecchio, una splendida vista sul Lago di Garda a solo 1 km da Riva nelle vicinanze del Lago di Tenno e delle Cascate del Varone. The space Garda View Guest House si trova a Gavazzo, una frazione del Comune di Tenno a 1 km da Riva del Garda, su una collina a circa 210 mt. di altitudine. La strada che da Riva del Garda (66 mt. altitudine) porta a Gavazzo è in salita. Posto all’ultimo piano di una casa di sole tre unità immersa nel verde degli ulivi e nella tranquillità, si compone di quattro locali: Cucina completa di elettrodomestici;  Bagno finestrato con lavatrice;  Camera matrimoniale;  Salotto (convertibile in seconda camera, il divano letto è di una piazza e mezza, adatto ad un adulto oppure due bambini); Sono inoltre disponibili: * un ampio balcone con splendida vista sul lago di Garda e i dintorni, * una cantina privata molto spazi",https://a0.muscache.com/pictures/13f6de8a-07bc-4f0d-8af2-e2f0604ce0f9.jpg,2017-01-08,within an hour,t,1.0,t,Entire home/apt,3,1 bath,1.0,2.0,"[""Long term stays allowed"", ""Heating"", ""Wifi"", ""Outdoor dining area"", ""Baking sheet"", ""Hair dryer"", ""Lockbox"", ""Oven"", ""Iron"", ""Freezer"", ""Free parking on premises"", ""Fire extinguisher"", ""Outdoor furniture"", ""Cleaning products"", ""Private patio or balcony"", ""Clothing storage: closet and dresser"", ""Air conditioning"", ""Stove"", ""Washer"", ""Bed linens"", ""Hot water kettle"", ""Coffee maker"", ""TV"", ""Cooking basics"", ""Luggage dropoff allowed"", ""Dining table"", ""First aid kit"", ""Refrigerator"", ""Hot water"", ""Essentials"", ""Dishes and silverware"", ""Kitchen"", ""Extra pillows and blankets"", ""Microwave"", ""Hangers""]",$60.00,0,40,4.97,4.95,4.95,4.97,5.0,4.82,4.85,t
6,ATTICO61,"Di proprietà della Fam. Boscolo, situato nel centro di Arco, a 5 km dal Lago di Garda, ATTICO61 offre una vista sul castello di Arco ed un balcone con vista sulle montagne. ATTICO61 dista a 49 km da Andalo, 69 km da Madonna di Campiglio e 85 km dall'aeroporto di Verona, lo scalo più vicino. CODICE CIPAT: 022006-AT-821346 The space È un appartamento provvisto di arredi moderni, connessione WI-FI gratuita in tutte le sue aree e TV a schermo piatto. Dispone di cucina completamente attrezzata con lavastoviglie e forno, area salotto con divano e balcone, 2 camere da letto e 2 bagni con bidet e asciugacapelli.",https://a0.muscache.com/pictures/53d0680a-8205-403f-8d2c-35605cf6a7b7.jpg,2021-01-26,within an hour,t,1.0,t,Entire home/apt,4,2 baths,2.0,2.0,"[""Heating"", ""Wifi"", ""Microwave"", ""Baking sheet"", ""Hair dryer"", ""Lockbox"", ""Crib"", ""Oven"", ""Free street parking"", ""Iron"", ""Freezer"", ""Cable TV"", ""Clothing storage: closet"", ""Children\u2019s books and toys"", ""Private entrance"", ""Fire extinguisher"", ""Cleaning products"", ""Private patio or balcony"", ""Bed linens"", ""Elevator"", ""Single level home"", ""Hot water kettle"", ""Coffee maker"", ""High chair"", ""Cooking basics"", ""Dining table"", ""Dishwasher"", ""Bidet"", ""Drying rack for clothing"", ""Refrigerator"", ""Hot water"", ""Portable fans"", ""Board games"", ""Wine glasses"", ""Essentials"", ""Dishes and silverware"", ""TV with standard cable"", ""Kitchen"", ""Extra pillows and blankets"", ""Dedicated workspace"", ""Children\u2019s dinnerware"", ""Hangers""]",$62.00,41,37,4.86,4.76,4.76,4.97,4.97,4.89,4.78,t
7,Agriturismo Al Gallo Nero Verde,"Free parking is available on the property. Pets are not allowed. Air conditioning is currently not available. Possibility of self check in. It needs to be arranged with the homeowner. With a view of the mountain, the holiday apartment Agriturismo Al Gallo Nero Verde, part of the reconstructed former monastery Gallo Verde in Tenno, is perfect for a relaxing holiday near Lake Garda with lots of opportunities for activities such as cycling, hiking or rock climbing. Other things to note Lake Ledro and Lake Molveno can also be reached by car. The 55 m² holiday apartment consists of a living room, a kitchen, 1 bedroom and 1 bathroom and can therefore accommodate 4 people. Additional amenities include Wi-Fi as well as a TV. Wi-Fi is only available in the common areas. A shared outdoor area, consisting of a garden, garden furniture and a covered terrace, is also available for your use. Walking/driving distance to nearest restaurant",https://a0.muscache.com/pictures/prohost-api/Hosting-595224701903635830/original/4d7007a7-fe22-4b25-9e21-f4f2d81f85ed.jpeg,2018-07-27,within an hour,f,526.0,t,Entire home/apt,4,1 bath,1.0,2.0,"[""Bed linens"", ""Essentials"", ""Long term stays allowed"", ""Free parking on premises"", ""Heating"", ""Wifi"", ""Hot water kettle"", ""Dishes and silverware"", ""Hair dryer"", ""TV"", ""Backyard"", ""Kitchen"", ""Oven"", ""Patio or balcony"", ""Stove"", ""Freezer"", ""Refrigerator""]",$112.00,89,1,5.0,5.0,5.0,5.0,5.0,5.0,5.0,t
8,Il Balcone sul Brenta,"""Il Balcone sul Brenta"" vi aspetta nel cuore di Lasino, piccolo borgo trentino immerso nel verde della Valle dei Laghi. A pochi km dall'alloggio si trovano sia il meraviglioso lago di Garda, sia i pendii del Monte Bondone (meta ideale per l'escursionismo estivo e per gli sport invernali quali sci alpino e sci di fondo). In una valle tutta da scoprire piena di laghi alpini e percorsi mozzafiato si trova questo appartamento ideale per un periodo di relax e sport. License number CIPAT:022243-AT-010642",https://a0.muscache.com/pictures/miso/Hosting-621685086010674455/original/6d37ac09-68d4-4b72-b952-488294bdc994.jpeg,2014-09-23,within an hour,f,2.0,f,Entire home/apt,2,1 bath,1.0,1.0,"[""Long term stays allowed"", ""Wifi"", ""Body soap"", ""Baking sheet"", ""Hair dryer"", ""Oven"", ""Freezer"", ""Toaster"", ""43\"" HDTV"", ""Clothing storage: closet"", ""Private entrance"", ""Free parking on premises"", ""Shampoo"", ""Cleaning products"", ""Ethernet connection"", ""Private patio or balcony"", ""Stove"", ""Bed linens"", ""Cooking basics"", ""Dining table"", ""Dishwasher"", ""Bidet"", ""Refrigerator"", ""Hot water"", ""Wine glasses"", ""Essentials"", ""Dishes and silverware"", ""Kitchen"", ""Central heating"", ""Extra pillows and blankets"", ""Shower gel"", ""Hangers""]",$64.00,78,5,4.8,4.8,5.0,5.0,5.0,4.8,5.0,t
9,Casa dei Foini - bikers' paradise,"House located in the village of Nago-Torbole, in the center of Nago (2 km. From Torbole), close to the village square, where there are a small supermarket, a bank with ATM, a few bars and restaurants- pizzerias; the house is very close to the bicycle path that leads to Lake Garda. The house, called Casa dei Foini, has been recently renovated with Florentine terracotta floors, and covers a total area of 180 square meters. The house is on 3 floors. The space The house is on 3 floors. The 80 square meters attic on the third floor includes a large kitchen with living room and a room with a double bed and with a characteristic Tyrolean style oven called Stanza dei Girasoli. On the second floor there are two rooms with double bed and two bathrooms: the larger one with a relax bathtub, the other with a big shower. On the first floor there is a wide entrance hall where guests can leave bicycles, surfing and all sports equipment; the flat is protected by an a",https://a0.muscache.com/pictures/b3cd9c6e-1e73-4436-9a9c-b7e182449d67.jpg,2015-07-01,within an hour,f,1.0,t,Entire home/apt,6,2 baths,3.0,3.0,"[""Long term stays allowed"", ""Conditioner"", ""Heating"", ""Body soap"", ""Wifi"", ""Baking sheet"", ""Hair dryer"", ""Carbon monoxide alarm"", ""Lockbox"", ""Oven"", ""Bikes"", ""Free street parking"", ""Clothing storage: dresser and closet"", ""Iron"", ""Freezer"", ""Toaster"", ""Smoke alarm"", ""Fireplace guards"", ""Private entrance"", ""Shampoo"", ""Cleaning products"", ""Ethernet connection"", ""Pocket wifi"", ""Private patio or balcony"", ""Stove"", ""Washer"", ""Bed linens"", ""Hot water kettle"", ""Coffee maker"", ""TV"", ""Ceiling fan"", ""Cooking basics"", ""Luggage dropoff allowed"", ""Dining table"", ""First aid kit"", ""Bathtub"", ""Dishwasher"", ""Bidet"", ""Drying rack for clothing"", ""Refrigerator"", ""Hot water"", ""Wine glasses"", ""Essentials"", ""Dishes and silverware"", ""Kitchen"", ""Extra pillows and blankets"", ""Shower gel"", ""Microwave"", ""Hangers""]",$220.00,37,74,4.9,4.9,4.81,4.97,4.97,4.74,4.82,t
10,"Panorámica mansarda ""Nogaiole""","mansarda peculiare rivestita di legno con vista panoramica a sud con sfondo le Dolomti del Brenta,su due piani con zona giorno,bagno e due camere The space Posizione Guest access Wi-fi gratis Other things to note una camera con letto matrimoniale e l' altra con letto a castello quindi adatto solamente per 3 adulti + 1 ragazzo",https://a0.muscache.com/pictures/159e2d67-9be3-4f49-b2a3-cbfe62f6c117.jpg,2013-11-30,within an hour,f,12.0,t,Entire home/apt,4,1 bath,2.0,1.0,"[""Washer"", ""Essentials"", ""Security cameras on property"", ""Free parking on premises"", ""Long term stays allowed"", ""Heating"", ""Fire extinguisher"", ""Wifi"", ""Dishes and silverware"", ""Hair dryer"", ""TV"", ""Smoke alarm"", ""Kitchen"", ""Cooking basics"", ""Stove"", ""Free street parking"", ""Microwave"", ""Refrigerator"", ""Hot water""]",$23.00,22,11,4.36,4.27,4.45,4.73,4.55,4.91,4.82,f
11,MBM Sport Apartments 22 Riva d/G 022153-AT-603521,"MBM Sport Apartments offre un alloggio situato a Riva del Garda che può essere usato come punto di riferimento per delle vacanze, sia nel periodo estivo che in quello invernale, all'insegna dello sport, della cultura, del relax e del benessere, grazie alla vicinanza del Lago di Garda, alle città di Trento, Rovereto e rinomate località sciistiche. Tra lago e montagna è sicuramente possibile dedicarsi a diverse attività sportive come la mountain bike o il windsurfing. The space Situato all'interno di un condominio al secondo piano di circa 48 metri quadri, dispone di sala/cucina, camera da letto, bagno, aria condizionata e un ampio terrazzo. Può ospitare fino a quattro persone, due delle quali su divano letto. Totalmente rinnovato, adatto a coppie, famiglie anche con bambini piccoli, a gruppi di amici e sportivi. Situato in una zona tranquilla a due passi dal Lago e a 15 minuti a piedi dal centro di Riva del Garda, con i principali servizi (presso il Centro ",https://a0.muscache.com/pictures/3c41a083-40d8-4000-8c30-503532c06ce6.jpg,2017-08-15,within an hour,t,2.0,t,Entire home/apt,4,1 bath,1.0,2.0,"[""Con freezer  refrigerator"", ""Long term stays allowed"", ""Wifi"", ""Stainless steel gas stove"", ""Hair dryer"", ""Crib"", ""Free parking garage on premises \u2013 1 space"", ""Clothing storage: closet"", ""AC - split type ductless system"", ""Private entrance"", ""Outdoor furniture"", ""Cleaning products"", ""Private patio or balcony"", ""Free washer \u2013 In unit"", ""Bed linens"", ""Security cameras on property"", ""Coffee maker"", ""Cooking basics"", ""Dining table"", ""Heating - split type ductless system"", ""Bathtub"", ""HDTV"", ""Bidet"", ""Drying rack for clothing"", ""Hot water"", ""Wine glasses"", ""Essentials"", ""Dishes and silverware"", ""Kitchen"", ""Central heating"", ""Microwave"", ""Standalone high chair"", ""Hangers""]",$104.00,74,36,4.92,4.89,5.0,5.0,4.89,4.56,4.72,t
12,B&B ANNA: Camera doppia tra Trento e Bolzano!,"Il b&b Anna si trova in Trentino, a Roverè della luna,un tranquillo borgo tra Trento e Bolzano nel cuore della piana Rotaliana. Per la sua posizione geografica strategica è possibile raggiungere in poco tempo le principali città: Trento, Bolzano,Merano. Inoltre percorrendo solo pochi km di auto si possono visitare le attrazioni più importanti: il lago di Molveno, il lago di Caldaro, i bellissimi e maestosi castelli della Val di Non, anche l’Altipiano della Paganella per chi ama la montagna. The space La camera accogliente, arredata in stile montano affaccia sul giardino. È dotata di TV a schermo piatto e bagno privato. C'è una sala comune dove è possibile fare colazione,consumare un buon pasto caldo dopo un'intera giornata se non si ha voglia di uscire a cena. Gli ospiti possono rilassarsi in sala bevendo un buon bicchiere di vino della zona o fermarsi a leggere un libro,infatti stiamo allestendo una picola libreria in sala. È possi",https://a0.muscache.com/pictures/miso/Hosting-44348256/original/cabb2592-72e3-47d9-a8a8-1300783fcae0.jpeg,2020-07-18,within an hour,f,4.0,t,Private room,2,1 private bath,1.0,1.0,"[""Long term stays allowed"", ""Heating"", ""Body soap"", ""Wifi"", ""Laundromat nearby"", ""Outdoor dining area"", ""Hair dryer"", ""Carbon monoxide alarm"", ""Crib"", ""Free street parking"", ""Clothing storage: dresser and closet"", ""Iron"", ""Freezer"", ""Toaster"", ""Smoke alarm"", ""Children\u2019s books and toys"", ""Free parking on premises"", ""Fire extinguisher"", ""Lock on bedroom door"", ""Cleaning products"", ""Ethernet connection"", ""Paid washer \u2013 In building"", ""Bed linens"", ""Host greets you"", ""Coffee maker"", ""Breakfast"", ""Shared patio or balcony"", ""TV"", ""High chair"", ""Luggage dropoff allowed"", ""Dining table"", ""First aid kit"", ""Room-darkening shades"", ""Drying rack for clothing"", ""Refrigerator"", ""Hot water"", ""Board games"", ""Portable fans"", ""Essentials"", ""Dishes and silverware"", ""Extra pillows and blankets"", ""Shower gel"", ""Microwave"", ""Hangers""]",$46.00,46,58,4.66,4.6,4.67,4.83,4.83,4.38,4.62,f
13,Appartamento Bellavista,"L’appartamento si trova in un contesto residenziale, all’interno di una palazzina signorile; è composto da una zona giorno molto ampia e luminosa, dotata di spazioso balcone, due camere da letto di cui una matrimoniale, e un bagno. All’esterno, nel cortile interno della casa è presente un posto auto custodito. Adiacente alla palazzina si trova un supermercato e il palazzetto dello sport, con campi da tennis, da basket, da beach volley, una palestra.. è il centro della vita del paese. Other things to note Lenzuola non in dotazione. Diamo la possibilità di noleggiarle tramite l’agenzia di pulizie cui ci affidiamo per l’igienizzazione della casa, per 20€ a persona.",https://a0.muscache.com/pictures/f229e848-0742-4793-b5b4-7d4a81379712.jpg,2019-03-27,within a day,f,1.0,t,Entire home/apt,6,1 bath,2.0,5.0,"[""Long term stays allowed"", ""Free parking on premises"", ""Heating"", ""Dishes and silverware"", ""Hair dryer"", ""TV"", ""Backyard"", ""Kitchen"", ""Cooking basics"", ""Oven"", ""Extra pillows and blankets"", ""Dishwasher"", ""Free street parking"", ""Iron"", ""Microwave"", ""Refrigerator"", ""Hot water"", ""Hangers""]",$194.00,85,2,4.5,5.0,4.5,5.0,5.0,5.0,5.0,f
14,"Boutique Apt with a view on Dolomites, ski in-out!","Brand new boutique Apt, completely renewed in natural wood. It is located in Campo Carlo Magno 2km away from Madonna di Campiglio and only 50mt from fantastic slopes and connections to the entire resort. Priceless ski-in and ski-out experience. Close to the apt (30 mt) you will find: food market, ski school, coffee shop, wellness center, public bus. There are a few tipical restaurants at walking distance (we suggest ""Casa De Campo"" and malga ""Zeledria""). We speak both italian and english. Other things to note Private ski depot and laundry room at ground floor, apt is on the 4th floor - there is no lift. Bed sheets, towels, soft duvets and pillows are supplied. Beds size: 1) 160*190cm 2) 140*190cm 3) 80*190 cm",https://a0.muscache.com/pictures/123bd1dc-a1a6-456f-b3d3-d805ef8b1466.jpg,2014-05-16,within a few hours,f,1.0,t,Entire home/apt,5,2 baths,2.0,4.0,"[""Long term stays allowed"", ""Heating"", ""Wifi"", ""Hair dryer"", ""Oven"", ""Nespresso machine"", ""Free parking on premises"", ""Ethernet connection"", ""Private patio or balcony"", ""Stove"", ""Washer"", ""Bed linens"", ""Coffee maker"", ""TV"", ""Backyard"", ""Cooking basics"", ""Ski-in/Ski-out"", ""Refrigerator"", ""Hot water"", ""Essentials"", ""Dishes and silverware"", ""Kitchen"", ""Dryer"", ""Hangers""]",$89.00,82,29,4.79,4.83,4.72,4.79,4.97,4.76,4.66,t
15,"appartamento ""la barberina"", il lago a pochi passi","appartamento molto ampio e indipendente, luminoso, termoautonomo, si trova a Calceranica al lago, vicino ad un supermercato, un pane e latte, un bar e un tabacchino. Il lago e' raggiungibile a piedi in pochi minuti Other things to note l'appartamento si trova al secondo piano, non c'e' ascensore",https://a0.muscache.com/pictures/9c5e81b8-6134-42d4-b44d-b3ba481c83fa.jpg,2019-08-13,within an hour,f,1.0,t,Entire home/apt,6,2 baths,3.0,6.0,"[""Essentials"", ""Private entrance"", ""Free parking on premises"", ""Heating"", ""Wifi"", ""Dishes and silverware"", ""Host greets you"", ""Hair dryer"", ""TV"", ""Crib"", ""Kitchen"", ""Cooking basics"", ""Luggage dropoff allowed"", ""Oven"", ""Patio or balcony"", ""Stove"", ""Refrigerator"", ""Hangers""]",$110.00,0,6,5.0,5.0,5.0,5.0,5.0,5.0,4.83,t
