Unnamed: 0,name,description,picture_url,host_since,host_response_time,host_is_superhost,host_listings_count,host_identity_verified,room_type,accommodates,bathrooms_text,bedrooms,beds,amenities,price,availability_90,number_of_reviews,review_scores_rating,review_scores_accuracy,review_scores_cleanliness,review_scores_checkin,review_scores_communication,review_scores_location,review_scores_value,instant_bookable
16,Logge dei Paroloti Agnese,"CIPAT code: 022231-AT-839195 House restored in 2020, mainly with green building products and attention to the recovery of existing materials, with treatment and care of wooden artefacts. At the Logge dei Paroloti you can live in tranquillity, with a view over the village of Dorsino, admiring the mountain panorama both from the covered loggia and from the garden, equipped and paved. Other things to note The loggia and garden are shared by guests to relax and enjoy the spaces and information points for the opportunities and experiences available in the area. On the ground floor there is a reading and TV room, extra flats, with the library created by the economic stove: an open space for reading and information (TV, maps and QrCode). The stove is in the same location and original room: Uncle Fiore's kitchen that lived in the family home until 2006. The structure is characterised by ""barrel vaults"" on both floors, with thick walls, accessories an",https://a0.muscache.com/pictures/prohost-api/Hosting-49513022/original/af203615-e88e-4285-a752-841e6b3ecc41.jpeg,2018-07-27,within an hour,f,624.0,t,Entire home/apt,4,1 bath,1.0,2.0,"[""Long term stays allowed"", ""Heating"", ""Wifi"", ""Hair dryer"", ""Crib"", ""Oven"", ""Free street parking"", ""Iron"", ""Freezer"", ""Free parking on premises"", ""Stove"", ""Bed linens"", ""Washer"", ""Elevator"", ""Hot water kettle"", ""Coffee maker"", ""TV"", ""High chair"", ""Backyard"", ""Cooking basics"", ""Patio or balcony"", ""Dishwasher"", ""Refrigerator"", ""Board games"", ""Essentials"", ""Dishes and silverware"", ""Kitchen"", ""Breakfast"", ""Microwave""]",$95.00,89,1,5.0,5.0,5.0,5.0,5.0,5.0,5.0,t
17,Arco - Riva del Garda - WiFi,"Don't miss our new flat!!! www.airbnb.it/rooms/5313325 The space In the beautiful, green and picturesque town of Arco in northern Italy in the province of Trentino, just 7 km from the most beautiful natural creation of Lake Garda, one-bedroom apartments are dealt with all amenities. Apartments 42 square meters. m include room, kitchen, shared bathroom. The room has two beds, sofa, dining table and a small closet. The kitchen is fully equipped. Shower. Very pretty and spacious apartment. Now separate the region of Trentino - one of the most beautiful regions of Italy, located in the north, our little town of Arco, lost among the mountains and olive groves. Pearl of the region is, of course, Lake Garda. It is incredibly beautiful. I believe that everyone in their life should see the beauty of the lake and the lakeside towns of Riva del Garda, Lazise, Limone, Malcesine. Their color is not just words. Here you can find a lot of castles, ancient Roman buildings",https://a0.muscache.com/pictures/d605721c-0379-4321-9c2e-063210e38fc7.jpg,2013-03-27,within an hour,f,1.0,t,Entire home/apt,4,1 bath,1.0,2.0,"[""Washer"", ""Essentials"", ""Long term stays allowed"", ""Private entrance"", ""Free parking on premises"", ""Heating"", ""Wifi"", ""Dishes and silverware"", ""Lake access"", ""TV with standard cable"", ""Kitchen"", ""Cooking basics"", ""Air conditioning"", ""Oven"", ""Free street parking"", ""Smart lock"", ""Hot water"", ""Cable TV"", ""Hangers""]",$80.00,15,168,4.78,4.83,4.86,4.91,4.92,4.66,4.77,f
18,Appartamento Aloch,"The comfortable apartment Aloch is located in the village of San Giovanni di Fassa and boasts an impressive view over the mountains. The apartment has a living room, a kitchen with a dishwasher, 2 bedrooms (one with a double bed and one with a single bed) and a bathroom and can therefore accommodate 5 people. Additional amenities include Wi-Fi, a washing machine and a television. A cot and a high chair are also available. Other things to note Start your day with a cup of coffee on your balcony or the shared terrace and enjoy the impressive view. The nearest restaurant and bar are 4 minutes away by foot or one minute away by car (300 m). You can do your shopping in the supermarket which is 3 minutes away by foot or one minute away by car (290 m). A ski and bicycle rental is located within 2 minutes walking distance or one minute by car (170 m). The amusement park ""Bimbo Neve"" for children is a 5-minute drive (1,8 km) away. A bus stop for the ski bus and the ski sl",https://a0.muscache.com/pictures/27d7cc34-2ca8-4064-afbf-159d9532a627.jpg,2018-07-27,within an hour,f,413.0,t,Entire home/apt,5,1 bath,2.0,3.0,"[""Washer"", ""Essentials"", ""Bed linens"", ""Free parking on premises"", ""Long term stays allowed"", ""Heating"", ""Wifi"", ""Coffee maker"", ""Dishes and silverware"", ""Hair dryer"", ""TV"", ""High chair"", ""Kitchen"", ""Patio or balcony"", ""Dishwasher"", ""Stove"", ""Free street parking"", ""Freezer"", ""Refrigerator""]",$71.00,89,4,5.0,5.0,5.0,5.0,5.0,5.0,5.0,t
19,Villa Lackas for 5 persons,"Note: You can directly book the best price if your travel dates are available, all discounts are already included. In the following house description you will find all information about our listing. 3-room semi-detached house 60 m2. Practical furnishings: living/sleeping room with 1 sofabed, dining table, satellite TV and heating stove. 2 rooms, each room with 2 beds. Kitchenette (oven, 4 gas rings, electric coffee machine). Shower/WC. Heating not available in all rooms. Terrace partl... The space ...y roofed, garden. Terrace furniture, deck chairs (2). View of the lake. Facilities: children's high chair. Please note: non-smokers only. Maximum 1 pet/ dog allowed.  Additional service charges may have to be paid locally on-site, see house rules and house manual for details. Please don't hesitate to contact us should you have any questions. Thank you. Semi-detached house ""Villa Lackas"". In the district of Vesta 8 km from the centre of ",https://a0.muscache.com/pictures/prohost-api/Hosting-18988658/original/e7818e9a-3ef3-4a1b-a77b-76f82a02abbc.jpeg,2017-05-19,within an hour,f,133.0,t,Entire home/apt,5,1 bath,2.0,5.0,"[""Long term stays allowed"", ""Private entrance"", ""TV"", ""Kitchen"", ""Oven"", ""Hangers""]",$15.00,1,2,5.0,5.0,5.0,5.0,5.0,5.0,5.0,t
20,"2 bedrooms and 3 bathrooms, 4/6 pers. Val di Fassa","Hello! We are Adriano and Natalia and we will be happy to meet you, your family and friends and even your pet and to host you all together in our guesthouse “Residence La Roggia”. Welcome to the Alps! Your home for your holiday in the Dolomites is tidy and clean. It is located in the center of Val di Fassa and is very convenient for your breathtaking summer hiking ortrekking in the mountains, panoramic walks, the most beautiful skiing on perfect alpine slopes and spectacular mountain bike rides. The space Our 8 apartments will let you have the freedom to live your holiday in the mountains as you like, they guarantee you privacy and the comfort of a real home where there is space for everyone, even for your suitcases. Here you will have a genuine contact with Val di Fassa and will experience the life like the real locals. And we will be at your disposal to advise you the best places to visit and to suggest you the activities to do. The 3-room apar",https://a0.muscache.com/pictures/miso/Hosting-34471070/original/437fa002-26dd-4a99-b3a6-9b0812b206af.jpeg,2014-01-21,within an hour,t,8.0,t,Entire home/apt,6,3 baths,2.0,3.0,"[""Washer"", ""Elevator"", ""Private entrance"", ""Free parking on premises"", ""Heating"", ""Fire extinguisher"", ""Shampoo"", ""Wifi"", ""Hair dryer"", ""TV"", ""Kitchen"", ""Iron"", ""Hangers""]",$86.00,26,1,5.0,5.0,5.0,5.0,5.0,4.0,5.0,t
21,Casa Oreadi. Comodità alpina,"Cozy, bright apartment, fully renovated with exposed wooden beams. The space The well-kept and comfortable apartment is located on the 1st floor of a traditional-style house adjacent to the park. The living area, with open kitchen equipped with everything you need (crockery, pots, coffee machine, dishwasher and oven, etc.), TV and double sofa bed (W. 140), has a balcony overlooking the garden. The room has a double bed, a wardrobe and a small desk. The bathroom has a shower, bidet and hairdryer. The apartment is equipped with WiFi internet access, bed linen and towels. A wash-machine / dryer is available to guests, as well as it is always possible to store bicycles or skis in the cellar. A cot for babies / children is also available on request. Location and surroundings Located in the lovely village of Sopramonte, in the suburbs of Trento at 600 meters above sea level. The neighborhood combines the beauty of a traditional ",https://a0.muscache.com/pictures/miso/Hosting-50729138/original/48289c98-5dab-42cb-ade0-c7301d57ca6e.jpeg,2014-02-12,within a few hours,f,1.0,t,Entire home/apt,4,1 bath,1.0,2.0,"[""Wifi"", ""Pour-over coffee"", ""Hair dryer"", ""Baking sheet"", ""Free washer \u2013 In building"", ""Radiant heating"", ""Oven"", ""Free street parking"", ""Iron"", ""Freezer"", ""Induction stove"", ""Toaster"", ""Crib - available upon request"", ""Clothing storage: closet"", ""Outdoor furniture"", ""Cleaning products"", ""Ethernet connection"", ""Private patio or balcony"", ""Host greets you"", ""Free dryer \u2013 In building"", ""Hot water kettle"", ""Coffee maker"", ""TV"", ""Backyard"", ""Cooking basics"", ""Luggage dropoff allowed"", ""Dining table"", ""First aid kit"", ""Dishwasher"", ""Bidet"", ""Drying rack for clothing"", ""Refrigerator"", ""Hot water"", ""Essentials"", ""Children\u2019s books and toys for ages 0-2 years old and 2-5 years old"", ""Dishes and silverware"", ""Kitchen"", ""Extra pillows and blankets"", ""Dedicated workspace"", ""Children\u2019s dinnerware"", ""Hangers""]",$77.00,15,11,5.0,5.0,5.0,5.0,5.0,5.0,4.91,f
22,The Lake House," The space Unique apartment, direct access to the beach from the large garden below. Bright and comfortable living area, both rooms overlooking the lake and ancient dolomites. 6 Total beds: 1° bedroom: double bed 2°bedroom: two single beds Living room: double sofa bed. Large balcony. Independent access. Numerous sports and cultural itineraries in the area, in both summer and winter. Complementary bottle of local wine on arrival.",https://a0.muscache.com/pictures/109666897/352164dc_original.jpg,2015-09-30,within a few hours,t,1.0,t,Entire home/apt,6,1 bath,2.0,3.0,"[""Long term stays allowed"", ""Heating"", ""Hair dryer"", ""Oven"", ""Free street parking"", ""Shampoo"", ""Private patio or balcony"", ""Stove"", ""Indoor fireplace"", ""Washer"", ""Host greets you"", ""Coffee maker"", ""TV"", ""High chair"", ""Cooking basics"", ""Refrigerator"", ""Hot water"", ""Essentials"", ""Dishes and silverware"", ""Kitchen"", ""Microwave"", ""Pack \u2019n play/Travel crib""]",$82.00,34,54,4.89,4.78,4.89,4.93,4.93,4.89,4.69,f
23,Val Fassa - 410 bertoli,"(022036-AT-051918) Four-room apartment on the second floor. Apartment has 3 bedrooms, (1 double, 1 with single bed + pullout and 1 with 2 single beds). One bathroom with tub, living room and independent kitchen. Wi-fi, washing machine, television, oven, dishwasher, 2 balconies and garage. NO PETS AND NO SMOKING VAL FASSA Apartment block is located close to the center of Campitello di Fassa providing easy access to facilities including ski bus stop, ski school, ski rental and mountain bike hire. Col Rodella cable car and Ischia sports center with the ADEL artificial climbing wall is only a distance of 500 meters. Located in the center are many services including supermarket, ATM, restaurants, bars and pizzeria. Close to many walking trails. VAL FASSA Apartment block is located close to the center of Campitello di Fassa providing easy access to facilities including ski bus stop, ski school, ski rental and mountain bike hire. Col Rodella cable car and Ischia s",https://a0.muscache.com/pictures/prohost-api/Hosting-15767498/original/9b61e202-e33d-4fd9-bfe8-dbfed179f5cc.jpeg,2016-09-12,within an hour,f,64.0,t,Entire home/apt,6,1 bath,3.0,6.0,"[""Bed linens"", ""Long term stays allowed"", ""Free parking on premises"", ""Heating"", ""Wifi"", ""Coffee maker"", ""Hair dryer"", ""High chair"", ""Crib"", ""Ethernet connection"", ""Free washer \u2013 In unit"", ""Oven"", ""Private patio or balcony"", ""Bathtub"", ""HDTV"", ""Iron"", ""Refrigerator""]",$122.00,84,2,5.0,5.0,5.0,5.0,5.0,5.0,5.0,t
24,Casa Formenti Codice CIPAT 022228-AT-523250,"Appartamento di 90mq, a piano primo, a Campo Minore, piccola Frazione del Comune di Comano Terme, a 2 km dalle Terme di Comano, a pochi km dai castelli di Stenico e Campo Lomaso, dai laghi di Tenno (13km) Garda e Molveno (25km). Dista 30km da Trento e 40km da Madonna di Campiglio. Lettini e il necessario per neonati e bambini (a richiesta). Possibilità di trasformare un letto singolo in letto a castello. Gratuita connessione Wi-Fi e parcheggio privato. Non adatto a persone diversamente abili. Other things to note La proprietà è completamente recintata e per accedervi c' è un cancello automatizzato. Il piazzale adiacente all'ingresso dell'appartamento è di circa 70 metri quadrati ed è a vostra disposizione. Qui troverete un tavolo e 2 panche in legno e nella appartamento avete a disposizione due sedie a sdraio. La restante proprietà esterna orto- prato NON sono a disposizione. License number CIPAT 022228-",https://a0.muscache.com/pictures/3529cb1e-18a0-43e8-98f8-001963fd9abe.jpg,2019-08-12,within an hour,f,1.0,f,Entire home/apt,5,1 bath,2.0,4.0,"[""Long term stays allowed"", ""Heating"", ""Wifi"", ""Baking sheet"", ""Hair dryer"", ""Carbon monoxide alarm"", ""Oven"", ""Iron"", ""Freezer"", ""Private entrance"", ""Free parking on premises"", ""Outdoor furniture"", ""Cleaning products"", ""Clothing storage: closet and dresser"", ""Stove"", ""Washer"", ""Bed linens"", ""Single level home"", ""TV"", ""Cooking basics"", ""Bathtub"", ""Bidet"", ""Drying rack for clothing"", ""Refrigerator"", ""Hot water"", ""Private fenced garden or backyard"", ""Essentials"", ""Dishes and silverware"", ""Kitchen"", ""Extra pillows and blankets"", ""Hangers""]",$65.00,55,9,4.89,5.0,5.0,5.0,5.0,4.78,4.89,f
25,Haus Cuel primo piano,"Appartamento di 65 mq con entrata, cucina , salotto, 2 stanze ( 1 matrimoniale con tv e 1 matrimoniale più letto a castello ) , bagno finestato più lavatrice , disbrigo. 2 balconi . Other things to note La quota comprende: sistemazione x 4 persone , presenze aggiuntive euro 10 a testa ( dopo le 4 persone ) . Riscaldamento se necessita fino a 2 giorni da pagare in loco alla partenza euro 10 al giorno .Dopo i 2 giorni pagamento previa lettura del contatore . Pulizie finali euro 20 License number 022087AT055911",https://a0.muscache.com/pictures/4f47c583-d907-4bf1-a829-3e4085e38e1e.jpg,2015-07-29,within a few hours,t,4.0,f,Entire home/apt,6,1 bath,2.0,6.0,"[""Long term stays allowed"", ""Heating"", ""Body soap"", ""Microwave"", ""Pour-over coffee"", ""Hair dryer"", ""Baking sheet"", ""Crib"", ""Oven"", ""Free street parking"", ""Iron"", ""Freezer"", ""Free parking on premises"", ""Free washer \u2013 In unit"", ""Clothing storage: closet and dresser"", ""Stove"", ""Bed linens"", ""Hot water kettle"", ""Coffee maker"", ""TV"", ""High chair"", ""Backyard"", ""Cooking basics"", ""Dining table"", ""Dishwasher"", ""Room-darkening shades"", ""Drying rack for clothing"", ""Baby bath"", ""Bidet"", ""Refrigerator"", ""Hot water"", ""Wine glasses"", ""Essentials"", ""BBQ grill"", ""Dishes and silverware"", ""Kitchen"", ""Changing table"", ""Extra pillows and blankets"", ""Children\u2019s dinnerware"", ""Pack \u2019n play/Travel crib"", ""Hangers""]",$99.00,3,7,5.0,5.0,5.0,5.0,4.86,4.86,5.0,f
26,"300 feets to ski tracks, nice flat","Nice apartment, 2 bedrooms (6 beds: 2+4), 300 feets to ski slopes, 10-15 minutes walk from center of Madonna di Campiglio. Very quiet and surrounded by woods. Living room with full-wall window looking at the Dolomites. Private garage included. The space There is a full-wall window with a e terrace and a fantastic view at the Dolomites. The sunrays can enter into the entire living room Guest access Guests have the entire apartment Other things to note No smoking in the apartment",https://a0.muscache.com/pictures/ab2dff2e-a2d9-48dc-8f77-101ca7d4c33a.jpg,2015-05-21,within an hour,f,1.0,t,Entire home/apt,6,1 bath,2.0,6.0,"[""Essentials"", ""Free parking on premises"", ""Heating"", ""Dishes and silverware"", ""Shampoo"", ""Kitchen"", ""Cooking basics"", ""Patio or balcony"", ""Ski-in/Ski-out"", ""Refrigerator"", ""Hot water""]",$105.00,70,39,4.62,4.59,4.38,4.65,4.78,4.89,4.51,f
27,Casa32 Classic,Rilassati e goditi tanto spazio in più in questo ampio alloggio. Adatto alle famiglie pratico,https://a0.muscache.com/pictures/8f6ef9f9-cd5d-4120-b79a-628306e0e202.jpg,2019-06-15,within an hour,f,4.0,t,Entire home/apt,6,1 bath,2.0,5.0,"[""Washer"", ""Security cameras on property"", ""BBQ grill"", ""Free parking on premises"", ""Long term stays allowed"", ""Fire extinguisher"", ""Wifi"", ""Outdoor dining area"", ""TV"", ""Kitchen"", ""Air conditioning"", ""First aid kit"", ""Dedicated workspace"", ""Outdoor shower""]",$128.00,56,4,5.0,5.0,5.0,5.0,5.0,4.75,5.0,t
28,003_Appartamento 2+2 con terrazza vista paese,"Appartamento nuovissimo e spazioso al piano terra, arredato con uno stile fresco e moderno, dotato di terrazza con vista sul paese. Una grande camera da letto, bagno finestrato con doccia e zona giorno open space con divano letto, tavolo da pranzo e cucina completamente attrezzata. Wifi veloce, parcheggio, deposito per l'attrezzatura sportiva. L'appartamento si trova all'interno di un Residence dotato di una grande terrazza/solarium sul tetto con una vista mozzafiato! The space Residence Aurora vi aspetta nel cuore dell’Alpe Cimbra, in una posizione privilegiata dalla quale poter ammirare dall’alto tutto l’Altopiano di Lavarone, i suoi profili montuosi, i suoi boschi e tutto il cielo quando è infuocato dal tramonto o impreziosito dalle stelle. L’intera struttura è stata completamente rinnovata ed è pronta ad aprire le porte per offrire la gioia di una vacanza indimenticabile in uno spazio pensato per essere accogliente, agile ed attrezzato per soddisfare ogni ne",https://a0.muscache.com/pictures/e59da1c3-33d3-4061-ad71-a49c86a34825.jpg,2021-01-23,within a few hours,t,15.0,t,Entire home/apt,4,1 bath,1.0,1.0,"[""Long term stays allowed"", ""Heating"", ""Body soap"", ""Wifi"", ""Hair dryer"", ""Carbon monoxide alarm"", ""Free washer \u2013 In building"", ""Iron"", ""Toaster"", ""Nespresso machine"", ""Free parking on premises"", ""Fire extinguisher"", ""Security cameras on property"", ""Free dryer \u2013 In building"", ""Coffee maker"", ""TV"", ""Dining table"", ""First aid kit"", ""Refrigerator"", ""Hot water"", ""Essentials"", ""Dishes and silverware"", ""Kitchen"", ""Dedicated workspace"", ""Microwave"", ""Hangers""]",$95.00,61,6,4.83,5.0,4.83,5.0,4.67,4.67,5.0,t
29,Tabià Elisa P1,"Typical renovated mountain heyloft, located in the beautiful Campitello di Fassa. The apartment has ski deposit, outside parking place, free wifi. THREE-ROOM APARTMENT, SLEEPS 4 P1: Apartment on the first top floor composed of living with cooking corner, one double bedroom, one bedroom with bunk bed, bathroom. . The space Typical renovated mountain heyloft, located in the beautiful Campitello di Fassa. The apartment has ski deposit, outside parking place, free wifi. THREE-ROOM APARTMENT, SLEEPS 4 P1: Apartment on the first top floor composed of living with cooking corner, one double bedroom, one bedroom with bunk bed, bathroom. Guest access Acces to the apartment, the storage and the garden Other things to note Included services - Heating: Services available according to season From 01/01 to 31/05. From 01/10 to 31/12. <br /",https://a0.muscache.com/pictures/prohost-api/Hosting-29251511/original/e0452c20-d9ab-47c4-ac41-bf8bc32c6ce9.jpeg,2016-10-26,within a few hours,f,47.0,t,Entire home/apt,4,1 bath,2.0,2.0,"[""Washer"", ""Essentials"", ""Bed linens"", ""Free parking on premises"", ""Long term stays allowed"", ""Heating"", ""Wifi"", ""Coffee maker"", ""Dishes and silverware"", ""Hair dryer"", ""TV"", ""Backyard"", ""Kitchen"", ""Cooking basics"", ""Oven"", ""Dishwasher"", ""Stove"", ""Free street parking"", ""Freezer"", ""Refrigerator""]",$366.00,0,7,4.71,4.71,4.86,4.29,4.86,4.86,4.71,t
30,Casa Filippi 2 - Codice CIPAT 022124-AT-067722,"Il mio alloggio è in centro storico, vicino al lago, ai negozi. Ti piacerà il mio alloggio per questi motivi: la posizione e l'atmosfera. Il mio all oggio è adatto a coppie, avventurieri solitari e famiglie. The space L'appartamento è di recentissima ristrutturazione, dotato di tutti i confrot indispensabili per una deliziosa vacanza (non è dotato di impianto di riscaldameto per le stagioni intermedie ed invernali) sulle rive del lago di Garda. E' dotato di un terrazzino ad uso esclusivo vista lago ed un altro condiviso dalla parte dell'ingresso verso la salita al ""Belvedere"". L'appartamento è dotato di deposito in comunione nel quale possono essere costudite biciclette, accessori per il wind-surf, ecc. La cucina è dotata anche di forno tradizionale, lavastoviglie e frigorifero con congelatore. Nell'alloggio è disponibile per gli ospiti una lavatrice. A richiesta è in dotazione un baby-bed (per bambini fino a 3 anni). Guest acces",https://a0.muscache.com/pictures/616f43fd-080a-4845-b79a-9428fb04cafa.jpg,2016-07-02,within a few hours,f,2.0,t,Entire home/apt,5,1 bath,2.0,3.0,"[""Washer"", ""Essentials"", ""Long term stays allowed"", ""Private entrance"", ""Wifi"", ""TV"", ""Kitchen"", ""Hangers""]",$85.00,17,21,4.71,4.9,4.95,5.0,4.95,4.95,4.7,f
31,Grande appartamento in montagna con caminetto 2,"Grande appartamento formato da ampio soggiorno con due divani, caminetto, tavolo, cucina con lavastoviglie e forno, camera matrimoniale, camera con 4 letti a castello, bagno con doccia (acqua calda da boiler elettrico di 80 litri), terrazza. L'appartamento si trova al piano terra del Residence Cinque Funghi, servito da ascensore, garage ed armadietto deposito sci.",https://a0.muscache.com/pictures/miso/Hosting-37376450/original/c44b705a-b29a-461b-9137-39ce362a4118.jpeg,2016-01-21,within a day,f,17.0,t,Entire home/apt,6,1 bath,2.0,6.0,"[""Long term stays allowed"", ""Heating"", ""Hair dryer"", ""Oven"", ""Free street parking"", ""Free parking on premises"", ""Fire extinguisher"", ""Private patio or balcony"", ""Stove"", ""Indoor fireplace"", ""Elevator"", ""Single level home"", ""TV"", ""Cooking basics"", ""Luggage dropoff allowed"", ""Dishwasher"", ""Ski-in/Ski-out"", ""Refrigerator"", ""Hot water"", ""Dishes and silverware"", ""Kitchen"", ""Extra pillows and blankets"", ""Hangers""]",$96.00,1,2,5.0,4.5,4.5,5.0,5.0,5.0,3.5,f
32,"Charming home in Carezza, Dolomites","My flat is situated in the Grand Hotel Carezza complex, a historical 19th century building chosen as a summer residence by Empress Elisabeth of Austria (Sissi). In winter time there are more than 40 km of ski slopes while in the summer it offers lovely walks in the woods, horseback riding, mountain bike and cycling, 9 holes Golf course just 5 min. away and tennis courts. The space The flat is full of natural light and charm, with traditional details merging with modern looks. It comfortably fits 5 people and parking is included. There is one bedroom with a double bed and a single sofa bed. In the living room there is a double sofa bed. There is one bathroom with bath tub and the kitchen is well-equipped. There is also a washing machine. Guest access Entire flat and all common areas of the building including ski storage, parking, and playroom (you can find ping pong equipment in the flat).",https://a0.muscache.com/pictures/d967c984-8549-47c8-ab38-ddc531425bc7.jpg,2016-03-27,within an hour,f,1.0,t,Entire home/apt,5,1 bath,1.0,3.0,"[""Long term stays allowed"", ""Shared garden or backyard"", ""Wifi"", ""Body soap"", ""Hair dryer"", ""Ping pong table"", ""Crib"", ""Clothing storage: wardrobe"", ""Oven"", ""Free street parking"", ""Children\u2019s books and toys for ages 0-2 years old, 2-5 years old, 5-10 years old, and 10+ years old"", ""Iron"", ""Toaster"", ""Smoke alarm"", ""Portable heater"", ""Fire extinguisher"", ""Shampoo"", ""Cleaning products"", ""Free washer \u2013 In unit"", ""Stove"", ""Free driveway parking on premises"", ""Bed linens"", ""Elevator"", ""Host greets you"", ""Hot water kettle"", ""Coffee maker"", ""High chair"", ""Cooking basics"", ""Luggage dropoff allowed"", ""Dining table"", ""First aid kit"", ""Bathtub"", ""Ski-in/Ski-out"", ""Drying rack for clothing"", ""Baby bath"", ""Refrigerator"", ""Hot water"", ""Board games"", ""Wine glasses"", ""Essentials"", ""Dishes and silverware"", ""Kitchen"", ""Central heating"", ""Extra pillows and blankets"", ""Dedicated workspace"", ""Shower gel"", ""Children\u2019s dinnerware"", ""Pack \u2019n play/Travel crib"", ""Hangers""]",$66.00,0,92,4.71,4.77,4.73,4.9,4.89,4.85,4.75,t
